Video Title,Published Date,Views,Likes,Comments
Google Top Geek E17 (Spanish),2013-03-18T18:41:40Z,1966,33,19
Google Drive SDK: Live from the Hackathon,2013-03-16T07:22:03Z,3283,41,0
Experiencia transformadora en el ecosistema tecnológico emprendedor,2013-03-14T22:32:55Z,1124,26,0
"Irrduino: A Sprinkler System Built Using Arduino, Android, Google App Engine, Python, and Dart",2013-03-14T17:31:41Z,38066,301,27
"BigQuery: Big JOINs, Big GROUP BY, Timestamps",2013-03-14T17:31:04Z,7824,29,0
Mobile Web Thursdays: Performance on Mobile,2013-03-14T16:55:22Z,4269,61,1
"The Breakpoint Ep. 6: Accelerating Load Time, Run Time, and JS tooling",2013-03-14T16:17:21Z,10763,161,11
Mobile Web Apps (GDL-IL),2013-03-14T08:25:08Z,1720,36,4
Getting Started with AdMob on iOS,2013-03-13T20:26:38Z,7802,30,4
Chrome Apps Office Hours: Synchronized File System,2013-03-13T20:22:21Z,2904,29,0
YouTube Developers Live: Code Simplicity with Max Kanat-Alexander,2013-03-13T17:59:12Z,6486,96,0
Google+ Developers Live: Come code with us!,2013-03-12T22:02:31Z,3244,67,0
Shortcuts: Earthquakes on the Move,2013-03-12T17:09:16Z,2371,20,0
Chrome Apps Office Hours: Alarms API,2013-03-12T16:22:29Z,4246,55,1
Root Access Goes Social: How to Get the Attention of Influential Bloggers,2013-03-11T18:01:26Z,1924,30,1
Google Top Geek E16 (Spanish),2013-03-11T02:29:46Z,3023,36,10
Mobile Web Apps (In Hebrew - GDL-IL),2013-03-10T14:19:09Z,1474,11,4
Payments Live - Wallet APIs Office Hours,2013-03-08T19:32:29Z,1387,20,0
Mobile Web Thursdays: What's New in Chrome for Android Beta,2013-03-07T18:32:00Z,5767,44,0
GDL Presents: Women Techmakers with Lorna Mitchell,2013-03-07T18:17:04Z,723,8,0
"Mi bolsa colaborativa en la nube, Google Drive API",2013-03-06T20:12:52Z,1944,23,4
YouTube Developers Live: Skimble,2013-03-06T18:29:49Z,2401,19,1
Google Apps Unscripted - March 2013,2013-03-06T16:34:41Z,1880,19,0
GDL Italia - Applicazioni Android con Maven,2013-03-06T15:42:23Z,1341,17,0
GDL presents: Women Techmakers with Dr. Sue Black,2013-03-06T12:09:30Z,1868,4,0
Google Cloud Endpoints and HTML5 (In Hebrew),2013-03-06T09:36:31Z,1953,12,9
Google+ Developers Live: Over-the-Air Installs,2013-03-05T22:59:05Z,1152,16,0
"Faster, smaller and more beautiful web with WebP",2013-03-05T22:01:08Z,14968,130,4
Google Drive SDK: Building Drive apps entirely on the cloud with Google Apps Script,2013-03-05T19:35:07Z,11524,95,5
Shortcuts: Using Storyboards with the Google Maps SDK for iOS,2013-03-05T18:07:15Z,10717,38,2
GDL Presents Women Techmakers with Trisha Gee,2013-03-05T17:44:01Z,1483,13,0
Root Access Talks Funding: Securing Seed Investment,2013-03-04T19:39:50Z,3626,78,1
Google Top Geek E15 (Spanish),2013-03-04T15:27:14Z,1575,39,10
Google Drive SDK: Integrating Google+ Sign-In with your Drive app,2013-03-01T18:25:39Z,3304,35,0
Un tsunami tecnológico. El aporte de las herramientas Google,2013-02-28T22:23:13Z,1356,45,0
Shortcuts: Getting Google Drive Data Onto a Map,2013-02-28T19:39:26Z,21518,153,17
Mobile Web Thursdays,2013-02-28T16:40:19Z,2442,37,0
Google Cloud Endpoints And HTML5 (GDL-IL),2013-02-28T09:01:22Z,3820,26,0
"Una metrópolis de Datos, enfoque Bigquery",2013-02-27T20:19:24Z,859,19,0
YouTube Developers Live: WebM,2013-02-27T18:38:48Z,8848,62,2
Chrome Apps Office Hours: Rich Notifications,2013-02-27T16:49:26Z,24505,96,9
Script It! with YouTube,2013-02-27T14:33:39Z,5757,64,7
Google+ Sign-In: Over-the-Air Installs,2013-02-27T01:18:13Z,11944,57,5
Google+ Sign-In: Trusted Authentication,2013-02-27T01:14:59Z,19888,63,1
Google+ Developers Live: Introducing Google+ Sign-In,2013-02-26T23:13:12Z,9750,137,1
Google+ Sign-In: Interactive Posts,2013-02-26T16:04:58Z,13505,77,5
Google+ Sign-In: App Customization,2013-02-26T16:04:41Z,8077,40,1
Google+ Sign-In: Boost Engagement & Installs,2013-02-26T16:03:06Z,143783,1478,76
[JP 日本語] Chrome+HTML5 Developers Live Japan #2,2013-02-26T12:17:50Z,1792,13,0
Web Components Now with Dart - JFokus 2013,2013-02-25T23:46:37Z,4046,48,7
Google Drive SDK: How to make your files Searchable,2013-02-25T17:22:49Z,11920,47,5
Google Top Geek E14 (Spanish),2013-02-25T05:10:48Z,1560,43,13
Google Drive SDK: Questions from the Google+ Community,2013-02-22T22:52:57Z,1966,19,0
GDL Italia - Android e Text-To-Speech: come far parlare la nostre app,2013-02-22T12:22:17Z,2054,26,0
Google Maps Developers Live: The Google Maps SDK for iOS v1.1,2013-02-21T20:00:00Z,27745,53,1
"App Engine: Cloud Endpoints, Pt II",2013-02-21T00:41:56Z,10411,82,3
YouTube Developers Live: BuzzFeed,2013-02-20T18:25:41Z,4915,21,1
DFP API Hangout with ADvendio,2013-02-20T16:52:20Z,2297,21,0
GDL Women Techmakers with Yael Karov,2013-02-20T07:44:35Z,1760,12,2
Dart with GWT,2013-02-19T20:27:26Z,4451,31,4
Chrome Apps Office Hours: System Info APIs,2013-02-19T17:34:07Z,1891,13,0
Google Top Geek E13,2013-02-18T13:28:41Z,3737,43,22
Google Drive SDK: Let users find your application,2013-02-15T18:13:42Z,3026,39,0
Udacity HTML5 Game Programming (CS255) Course Launch,2013-02-14T19:42:48Z,21435,271,0
Identity Hoodoo Voodoo,2013-02-14T19:17:28Z,1737,10,0
Apps Script Crash Course: ScriptDb,2013-02-14T16:34:44Z,8897,82,3
GDL Italia - Offline HTML5 Agenda (parte 1),2013-02-14T15:39:05Z,1946,18,0
App Engine: Cloud Endpoints,2013-02-14T00:47:47Z,36591,198,8
YouTube Developers Live: Soundslice,2013-02-13T18:24:06Z,15102,43,0
Google Drive App Review: Atooma,2013-02-12T19:39:32Z,5884,51,0
State of the Script 2013,2013-02-12T19:02:55Z,5782,34,1
Edge Conference - Panel 7: Testing and tooling,2013-02-12T06:27:28Z,17673,130,16
Edge Conference - Panel 6: Privileged access,2013-02-12T03:56:12Z,2012,10,4
Edge Conference - Panel 5: Input,2013-02-12T01:41:41Z,3332,12,3
Edge Conference - Panel 4: Responsive Layout,2013-02-11T23:03:22Z,5157,28,8
Edge Conference - Panel 3: Performance,2013-02-11T19:35:18Z,6246,26,4
"Functions are Fun, pt 1 - Dart Tips, ep. 6",2013-02-11T17:27:30Z,5038,76,5
Edge Conference - Panel 2: Network,2013-02-11T16:43:54Z,3912,22,3
Behind the div's: A Look at Find Your Way To Oz,2013-02-11T11:42:06Z,2839,45,0
Google Top Geek E12,2013-02-11T02:11:29Z,3590,39,22
Edge Conference - Panel 1: Offline,2013-02-09T19:00:35Z,11017,80,9
Google Drive SDK: Using the Drive API with the Google Apps Marketplace,2013-02-08T18:25:14Z,3678,22,0
Google Maps Garage: Getting Vector Data into Google Maps,2013-02-07T19:29:33Z,15315,68,2
YouTube Developers Live: Debugging & Dealing with Errors,2013-02-06T21:00:54Z,24420,61,8
Google Apps Unscripted - February 2013,2013-02-06T20:08:48Z,2087,19,0
Screen Intensity - Episode 1,2013-02-05T20:00:38Z,3334,30,13
Google Drive SDK: What is the Early Access Program?,2013-02-05T19:10:23Z,1254,25,0
Task Queue Basics,2013-02-05T18:10:20Z,31432,157,3
Memcache Basics,2013-02-05T18:10:15Z,115283,721,16
"Datastore Query, Index and Transaction",2013-02-05T18:10:10Z,46507,226,9
Datastore Introduction,2013-02-05T18:10:04Z,87317,354,11
User APIs and Authentication,2013-02-05T18:09:58Z,19838,35,2
Managing Your App,2013-02-05T18:09:53Z,8175,18,1
App Engine Architecture and Services,2013-02-05T18:09:45Z,37912,217,10
Chrome Apps Office Hours: Hack-a-thon Results,2013-02-05T17:44:20Z,2130,25,0
GDL Italia - Iniziare con AppEngine e Python,2013-02-05T08:55:34Z,2523,38,6
Google Top Geek E11,2013-02-04T16:41:45Z,1578,23,8
Overview of Google PageSpeed Service,2013-02-01T23:24:56Z,31679,301,28
Introducing PageSpeed Service from Google,2013-02-01T20:05:49Z,147570,271,11
Google Drive SDK: Integrating your app with the Android Drive app,2013-02-01T18:29:47Z,45044,201,12
YouTube Developers Live: 9x9.tv,2013-01-30T18:32:48Z,1828,27,0
Google Maps Developers Live: Photo Spheres and Street Views,2013-01-30T05:35:30Z,12206,62,8
Creative Sandbox presents Face Arcade - Hangout Highlights,2013-01-29T22:24:37Z,1018,6,0
Creative Sandbox presents Skyfall - Hangout Highlights,2013-01-29T22:24:01Z,771,5,0
Creative Sandbox presents Meet the Prius - Hangout Highlights,2013-01-29T22:22:40Z,839,4,0
Creative Sandbox presents Alka-Seltzer from Project Re: Brief - Hangout Highlights,2013-01-29T22:21:50Z,937,5,0
Creative Sandbox presents Nature Valley Trail View - Hangout Highlights,2013-01-29T22:20:50Z,985,10,0
Creative Sandbox presents Band of Bridges - Hangout Highlights,2013-01-29T22:18:50Z,858,6,1
"Google Drive SDK: Apps & OAuth - Recent Changes, Tips & Tricks",2013-01-29T19:21:21Z,1191,19,0
Google Top Geek E10,2013-01-28T13:05:05Z,2534,21,8
LA Video Hackathon Demo Nite,2013-01-28T04:27:22Z,10872,88,2
Dart M3 Office Hours,2013-01-25T20:05:11Z,2615,22,9
Dartisans ep. 17: Continuous Integration with Drone.io,2013-01-25T19:59:47Z,43496,113,3
[JP 日本語] Chrome+HTML5 Developers Live Japan #1,2013-01-25T01:17:51Z,2839,19,0
Apps Script Crash Course: ContentService,2013-01-24T19:03:16Z,10985,112,1
YouTube Developers Live: Telly,2013-01-23T18:26:24Z,2092,16,0
Google Maps Developers Live: High-performance Geospatial Visualizations using WebGL,2013-01-22T18:31:04Z,8833,57,0
Google Top Geek E09,2013-01-21T15:09:15Z,2281,29,10
GDL Presents Santa Tracker: Android,2013-01-18T22:04:38Z,3455,32,7
GDL Presents: Santa Tracker Chrome,2013-01-18T21:57:20Z,5105,33,0
Payments Live - Wallet APIs Office Hours,2013-01-18T19:21:54Z,1774,17,0
Google Drive App Review: Cooliris,2013-01-18T18:21:19Z,9887,21,0
Google Maps Garage: Pushing the Pin Beyond the Limit,2013-01-17T19:36:44Z,9373,46,1
GDL Italia - Migliorare un form di upload con Javascript e Chrome,2013-01-17T17:54:57Z,2407,22,10
YouTube Developers Live: Interesante,2013-01-16T18:41:03Z,2982,34,0
GDL Israel on HTML5 Game (In Hebrew),2013-01-16T09:07:21Z,2615,21,17
Glass Developer Update,2013-01-16T04:40:18Z,88934,280,54
Google Top Geek E08,2013-01-14T19:15:05Z,2326,32,13
Breakpoint Episode 5: DevTools Grab bag,2013-01-12T01:01:08Z,13436,199,40
YouTube Developers Live: Things New Developers Say,2013-01-09T18:52:06Z,3615,33,0
Google Maps Garage: Mapmaking Excellence with Chrome DevTools,2013-01-08T19:11:50Z,5667,49,8
Google Maps Developers Live: Places API Radar Search and Photos,2013-01-07T22:14:59Z,3434,15,2
Esto es Dart,2013-01-07T21:19:08Z,11026,343,20
GDL Italia - Risorse per iniziare con AppEngine,2013-01-07T15:01:32Z,1775,17,0
GDL Presents: Creative Sandbox | Google+ API,2013-01-02T19:00:49Z,4380,41,8
YouTube Developers Live: YouTube Android Player API Overview,2012-12-21T21:41:06Z,228508,265,28
GDL Presents: Women Techmakers & Panorama Software,2012-12-20T22:28:44Z,1366,16,0
Google Drive SDK: What happened in 2012 and what's coming in 2013,2012-12-20T19:57:45Z,7108,51,0
Web Audio Part 2 with Chris Wilson,2012-12-20T17:38:17Z,4601,57,0
Querying Massive Datasets using Google BigQuery,2012-12-19T22:58:53Z,18358,127,5
YouTube Developers Live: WeVideo,2012-12-19T18:31:09Z,2558,28,0
App Engine: Easier auth with OAuth2Decorator,2012-12-19T17:38:52Z,5992,56,0
Dartisans ep. 5: Meet the Dart VM Team,2012-12-19T00:31:45Z,1422,14,2
AdMob: Getting Started on Android,2012-12-18T18:59:34Z,9046,33,13
Chrome Apps Office Hours: Demo Fest,2012-12-18T17:38:18Z,4510,28,0
GDL Presents: Women Techmakers & Codecademy,2012-12-17T23:28:21Z,2134,37,5
Google Drive App Review: draw.io,2012-12-17T22:00:24Z,16875,32,4
GDL Italia - Google Cloud Messaging,2012-12-17T17:15:29Z,4170,21,6
GDL Presents: Women Techmakers & ClearStreet,2012-12-14T23:17:27Z,1709,17,0
Google Payments - Wallet APIs Office Hours,2012-12-13T21:09:02Z,1422,14,1
Google Drive SDK: Questions from the Google+ Community,2012-12-13T19:51:28Z,1157,12,0
DoubleClick for Publishers API Hangout with maanto,2012-12-13T17:38:28Z,1973,9,0
Google TV Developers Office Hours 12/12/12,2012-12-13T16:12:07Z,1604,11,2
GDL Presents: Women Techmakers and Code for America,2012-12-12T23:17:26Z,1373,15,0
YouTube Developers Live: Tech Talk on YouTube API v3,2012-12-12T19:22:02Z,250024,397,43
DoubleClick For Publishers API Hangout with Yieldex,2012-12-12T17:23:02Z,2226,8,0
Chrome Mobile: The Mobile Web Developers Toolkit (Part 2),2012-12-12T17:18:03Z,1911,25,1
GDL Presents: Women Techmakers & Kiva.org,2012-12-11T23:30:12Z,1593,16,0
Building a Charts Dashboard with Google Apps Script,2012-12-11T20:49:04Z,91275,585,27
"Google Maps Garage: Loading, Tweaking, and Exporting Data",2012-12-11T18:39:49Z,11131,41,2
Chrome Apps + Native Client,2012-12-11T17:38:12Z,28118,131,11
Google Drive SDK: Writing your first Drive app on iOS,2012-12-10T21:55:32Z,22491,58,7
Google Top Geek E07,2012-12-10T17:18:55Z,1434,17,10
Using Apps Script with Twilio,2012-12-10T15:30:23Z,17830,130,4
The Breakpoint Ep. 4 —The Tour De Timeline,2012-12-07T17:41:35Z,13567,97,1
GDL Presents: Internet Freedom and the ITU,2012-12-07T00:30:36Z,1502,14,0
Behind the Code: The Analytics Mobile SDK v2,2012-12-06T22:40:51Z,4407,30,0
"Apps Script Office Hours - December 6, 2012",2012-12-06T21:49:46Z,1287,8,0
"Life, Identity, and Everything",2012-12-06T17:58:28Z,2115,28,0
App Engine: New experimental dev server for Python,2012-12-06T02:05:58Z,2123,22,2
GDL Presents: Entrepreneurs on the #freeandopen web,2012-12-06T00:14:48Z,1000,22,0
YouTube Developers Live: Geofeedia,2012-12-05T18:47:44Z,4026,25,6
Chrome Mobile: The Mobile Web Developers Toolkit (Part 1),2012-12-05T17:14:46Z,11098,115,3
GDL Presents: The State of Our Web,2012-12-05T02:54:25Z,1319,16,0
Structural and Sampling (JavaScript) Profiling in Google Chrome,2012-12-04T22:14:03Z,20414,188,3
Introduction to Google Apps Script Triggers,2012-12-04T20:56:21Z,109400,691,48
Dartisans ep. 16: Dart and Web Components Reloaded,2012-12-04T20:03:55Z,4495,34,1
Chrome Apps Office Hours - 3rd Party Authentication,2012-12-04T17:41:00Z,5575,36,3
BigQuery: Simple example of a data collection and analysis pipeline + Your questions,2012-12-04T00:58:35Z,9782,56,1
Google Maps Developers Live: Google Maps Android API V2,2012-12-03T18:51:02Z,29892,102,25
Google Top Geek E06,2012-12-03T18:20:22Z,2047,34,7
GDL Italia - AdWords Scripts,2012-12-03T17:00:52Z,654,8,0
Integrating Google Apps with Salesforce using Google Apps Script,2012-11-30T20:46:00Z,25645,128,7
Web Performance Anomaly Detection with Google Analytics,2012-11-30T20:25:25Z,6258,56,5
"Google Games Chat, Episode #9",2012-11-29T22:57:13Z,2684,23,0
"Apps Script Office Hours - November 29, 2012",2012-11-29T22:09:32Z,1645,12,0
Off the Charts: Getting Cost Data into Google Analytics,2012-11-29T21:37:34Z,8396,29,0
Google Payments - Games Monetization,2012-11-29T18:25:33Z,3374,46,0
Google TV Developers office hours Nov.28.2012,2012-11-28T23:48:18Z,1994,8,1
Google Maps Garage: Working with JSON Objects,2012-11-28T22:32:16Z,31842,185,7
YouTube Developers Live: Magisto,2012-11-28T21:03:05Z,2572,20,5
"Dartisans ep. 15: A Re-Introduction to Dart Editor for the First Time, Again",2012-11-27T19:32:57Z,3541,53,3
Chrome Apps Office Hours - the WebView Control,2012-11-27T17:53:59Z,5883,37,2
Google Drive SDK: Writing your first Drive app on Android,2012-11-26T22:00:52Z,53077,231,17
Google Top Geek E05,2012-11-26T20:16:39Z,1825,20,6
"유튜브를 활용한 게임 확산 전략 (Start Playing The Distribution Game on YouTube, live from Seoul)",2012-11-21T20:42:36Z,2771,17,9
YouTube Developers Live: LinkTV,2012-11-21T18:47:53Z,3241,26,0
GDL Presents: Creative Sandbox | Google Maps API,2012-11-21T15:53:40Z,1526,15,5
Common mistakes when developing Maps apps,2012-11-20T18:27:30Z,237626,318,17
Chrome Apps Office Hours—The Media Galleries API,2012-11-20T17:27:04Z,2130,18,1
Google Top Geek E04,2012-11-19T20:01:39Z,2306,25,8
Introduction to Chrome Apps,2012-11-19T18:21:41Z,85148,407,23
Devoxx 2012: Android,2012-11-19T18:13:07Z,3666,30,4
GDL Italia - Unconventional webapps con GWT/Elemental WebRTC e WebGL (2/2),2012-11-19T17:31:53Z,1097,5,0
Devoxx 2012: Tim Bray,2012-11-16T22:38:42Z,1760,11,2
Devoxx 2012: WebRTC,2012-11-16T22:34:39Z,1434,18,6
Devoxx 2012: Google App Engine and Compute Engine,2012-11-16T22:27:18Z,1587,20,5
Devoxx 2012: Dart,2012-11-16T22:18:44Z,1866,27,3
Devoxx 2012: AngularJS,2012-11-16T22:10:13Z,16390,69,8
Devoxx 2012: Front End Performance,2012-11-16T21:28:09Z,1982,28,4
GDL Presents: Creative Sandbox | YouTube API,2012-11-16T04:00:36Z,1460,10,0
Google Maps Garage: Mapping with Style,2012-11-16T00:00:15Z,11671,52,5
App Engine Hangout - Chat with the PMs,2012-11-15T23:45:13Z,869,7,1
Automate Your Google Analytics Reporting with Apps Script,2012-11-15T23:03:11Z,19456,145,4
"Evolución de software, los nuevos desafíos de la actual industria de software",2012-11-15T20:39:52Z,6456,40,0
Google Drive SDK: Announcing the Comments API,2012-11-15T19:50:03Z,8852,24,2
Payments Developers Live - Wallet APIs,2012-11-15T18:20:59Z,1270,28,0
The Breakpoint Ep 3: The Sourcemap Spectacular with Paul Irish and Addy Osmani,2012-11-15T17:44:40Z,17448,111,0
Google Top Geek E03,2012-11-14T22:12:14Z,2128,20,9
Google Top Geek E02,2012-11-14T22:11:31Z,5019,11,4
GDL Presents: Creative Sandbox | DoubleClick Rich Media,2012-11-14T20:14:43Z,1856,11,0
YouTube Developers Live: The YouTube Analytics API,2012-11-14T18:36:30Z,2062,23,2
"Apps Script Office Hours - November 14, 2012",2012-11-14T17:14:04Z,748,13,0
Chrome Mobile Monthly: Responsive vs Separate Sites,2012-11-14T16:43:35Z,8474,108,1
"Wait, Chrome Dev Tools could do THAT?",2012-11-14T15:47:07Z,107929,862,7
Extending Chrome DevTools for fun and profit...,2012-11-14T15:46:43Z,15829,144,0
Google+ Platform Office Hours: A Movember of Metro-style Apps!,2012-11-13T22:51:12Z,1306,28,0
[JP 日本語] Chrome+HTML5 Developers Live Japan #0 :,2012-11-13T12:18:19Z,2943,21,1
Great Web Apps With New HTML5 APIs (in Hebrew),2012-11-13T10:57:18Z,3370,26,19
Google Drive SDK: Managing revisions,2012-11-12T21:38:23Z,10153,28,1
GDL Presents: Creative Sandbox | Mobile,2012-11-12T20:20:14Z,2153,20,0
GDL Presents: Women Techmakers with bitly,2012-11-09T23:46:48Z,1946,21,0
GDL Presents: Women Techmakers with Pixability,2012-11-09T23:01:02Z,1418,19,0
"Apps Script Office Hours - November 9, 2012",2012-11-09T20:34:21Z,1550,8,0
"GDL Italia - Unconvential webapps con GWT/Elemental, WebRCT e WebGL (1/2)",2012-11-09T18:39:59Z,1350,14,0
GDL Presents: Women Techmakers with Diane Greene,2012-11-08T23:13:37Z,1056,14,0
Google Drive App Review: Ultradox,2012-11-08T19:49:43Z,5694,28,1
GDL Presents: Women Techmakers with SoftTech VC and NewME Accelerator,2012-11-07T23:27:36Z,1620,19,1
"La evolución en lenguajes de programación, DART en detalles",2012-11-07T20:45:48Z,4252,57,0
YouTube Developers Live: The New Data API,2012-11-07T18:42:58Z,4255,111,4
GDL Presents: Women Techmakers with Pixel Qi,2012-11-06T23:37:11Z,1762,29,0
GDL Presents: Women Techmakers with JESS3,2012-11-05T23:23:03Z,3192,24,0
Google Drive: Share your files on Google+,2012-11-05T21:52:05Z,3675,27,1
GDL Italia - Google Drive SDK Intro,2012-11-02T20:45:28Z,2012,24,3
"GDL Presents Push the Limits: Chrome Web Lab, Teleporter",2012-11-02T19:57:23Z,1571,9,2
"Google Maps Developers Live: Ships, Polylines, Symbols, Oh My!",2012-11-02T19:06:13Z,11390,81,0
Wallet APIs Office Hours,2012-11-02T17:20:41Z,1321,34,0
"GDL Presents Push the Limits: Chrome Web Lab, Data Tracer",2012-11-01T19:56:26Z,2118,11,0
Google Drive SDK Office Hours,2012-11-01T18:59:12Z,1136,20,0
Udacity: Teaching thousands of students to program online using App Engine,2012-11-01T18:00:21Z,6687,89,0
The Breakpoint Ep. 2: Chrome DevTools with Paul Irish and Addy Osmani,2012-11-01T16:41:59Z,26081,224,1
Google TV Developers Office Hours Oct.31.2012,2012-10-31T22:52:31Z,1688,10,2
"GDL Presents Push the Limits: Chrome Web Lab, Sketchbots",2012-10-31T19:02:51Z,1293,10,2
YouTube Developers Live Halloween special: HootSuite,2012-10-31T17:36:05Z,4322,20,0
Google+ Platform Office Hours: A Showcase of Community Development,2012-10-30T22:03:47Z,1856,13,0
"GDL Presents Push the Limits: Chrome Web Lab, Universal Orchestra",2012-10-30T19:07:10Z,1773,16,0
Dartisans ep. 14: Dart Community Demos,2012-10-30T18:51:50Z,2730,16,0
Chrome Apps Office Hours: NodeJS in Chrome packaged apps,2012-10-30T16:52:09Z,36056,286,8
Google Drive SDK: Service accounts,2012-10-29T20:43:25Z,17880,80,7
"GDL Presents Push the Limits: Chrome Web Lab, Lab Tag Explorer",2012-10-29T20:09:39Z,1207,7,2
GDL-IL Chrome DevTools tips,2012-10-26T21:54:31Z,3274,32,2
Google Games Chat #7,2012-10-25T21:55:14Z,3741,38,0
Google Drive SDK: Searching for files,2012-10-25T18:53:02Z,20145,71,8
"Apps Script Office Hours - October 25, 2012",2012-10-25T15:33:44Z,2555,14,0
App Engine Hangout - chat with an App Engine Software Engineer in Test,2012-10-25T00:02:17Z,2982,27,1
YouTube Developers Live: Freebase API for YouTube Developers,2012-10-24T17:33:55Z,7344,54,3
Adwords API GDL,2012-10-24T13:42:09Z,1594,16,0
Google+ Platform Office Hours: Upcoming Changes to the Activities API,2012-10-23T21:45:51Z,1290,14,0
Using Apps Script with BigQuery: A developer perspective,2012-10-23T20:00:45Z,9915,66,2
Google Maps Developers Live: A Journey of 245k Points,2012-10-23T17:45:54Z,7762,54,0
Chrome Apps Office Hours: Text to Speech API,2012-10-23T16:32:11Z,22410,96,8
Google TV Developers Hangout Oct.17.2012,2012-10-22T23:18:30Z,2846,12,3
Google Drive App Review: Spreadshirt Designer,2012-10-22T20:52:48Z,2086,20,1
GDL Presents: Van Gogh Meets Alan Turing,2012-10-19T17:37:08Z,3102,23,0
"Apps Script Office Hours - October 18, 2012",2012-10-18T21:02:15Z,1299,12,0
Google Drive SDK: Third-party thumbnails and image metadata,2012-10-18T18:51:24Z,14180,41,5
Payments Developers Live - Wallet APIs Office Hours,2012-10-18T17:30:37Z,1174,28,0
ChromeVox for Web Accessibility,2012-10-17T18:59:56Z,8428,54,1
YouTube Developers Live: Pixability,2012-10-17T17:58:01Z,1631,22,0
Drive and Android teams in TLV hackathon,2012-10-17T16:02:50Z,984,8,1
Introducing Dart,2012-10-16T23:24:20Z,343009,4017,257
How to use Dart Editor,2012-10-16T23:24:04Z,53048,218,19
What's New in the Google+ Mobile Platform,2012-10-16T21:52:34Z,1874,33,0
Dartisans ep. 13: An M1 Birthday Special!,2012-10-16T18:49:28Z,2779,30,0
Google Maps API Round-up (16 Oct 2012),2012-10-16T17:23:24Z,5852,44,1
Google Drive SDK: Sharing files and managing permissions,2012-10-15T20:58:55Z,62037,124,1
Google Games Chat #6,2012-10-11T22:02:29Z,6067,40,0
Google Drive SDK: Managing your Drive files with Apps Script,2012-10-11T18:51:50Z,9721,50,3
GDL Presents: All the Web's a Stage,2012-10-11T18:26:06Z,6553,12,0
The Breakpoint Ep. 1: Chrome DevTools with Addy Osmani and Paul Lewis,2012-10-11T16:47:14Z,53112,473,4
Webify Your Game,2012-10-11T08:01:26Z,2256,63,0
Native Client Acceleration Modules,2012-10-11T08:00:44Z,1937,27,0
"YouTube Developers Live: What's Up, Docs?",2012-10-10T17:45:52Z,1058,8,0
GDL Presents: Make Web Magic | Part III,2012-10-09T21:55:14Z,13157,164,16
App Engine Hangout - Developer Chat with Alex Vagin,2012-10-09T21:48:41Z,1338,7,1
"GDL Italia - Presentazione GDL, GDA, DevFest",2012-10-09T21:46:46Z,1504,21,2
GDL Presents: Make Web Magic | Part II,2012-10-09T21:00:41Z,4444,16,0
GDL Presents: Make Web Magic | Part I,2012-10-09T20:00:04Z,3508,37,5
Introduction to Web Platform Docs,2012-10-09T19:22:40Z,11497,81,1
Chrome Apps Office Hours: Networking APIs,2012-10-09T16:52:14Z,7893,46,2
Google Drive App Review: Neutron Drive,2012-10-08T20:58:16Z,5232,43,1
The Inner Awesomeness of More than a Map,2012-10-08T18:36:04Z,5296,28,0
Debunking Dart Myths For Web Developers,2012-10-08T16:41:55Z,11336,90,4
G+ Platform Office Hours -- Retrieving Profile Information with the Sign In Button,2012-10-05T17:33:21Z,3257,45,10
"BigQuery - UK dev community, JSON, nested/repeated, improved data loading -   Live from London",2012-10-05T15:45:08Z,5298,24,0
Make the Web Fast: Automagic site optimization with mod_pagespeed 1.0!,2012-10-04T23:09:50Z,104739,472,54
Payments Developers Live - Wallet APIs Office Hours,2012-10-04T22:27:40Z,957,28,0
"Apps Script Office Hours - October 4, 2012",2012-10-04T20:56:26Z,1892,8,0
Google Drive SDK: Downloading FIles,2012-10-04T19:48:50Z,12853,24,4
YouTube Developers Live: Magnify.net,2012-10-03T20:16:16Z,1713,20,4
More Than a Map - Kekanto,2012-10-03T16:02:29Z,4670,37,2
More Than a Map - Epungo,2012-10-03T16:02:05Z,11873,174,43
More Than a Map - Ubilabs,2012-10-03T16:01:43Z,6014,29,1
More Than a Map - Upande,2012-10-03T16:01:20Z,5955,46,1
More Than a Map - Computerlogy,2012-10-03T16:01:04Z,7351,48,6
More Than a Map - GetFlight.com.au,2012-10-03T16:00:42Z,6588,42,11
More Than a Map #morethanamap,2012-10-03T16:00:12Z,94376,537,29
Geo for Good Summit Highlights,2012-10-02T17:43:23Z,3242,26,1
Chrome Apps Office Hours: Building awesome multi-window apps,2012-10-02T16:40:00Z,6695,66,5
Google Drive SDK: Writing your first Drive app in JavaScript,2012-10-01T20:43:57Z,39590,123,13
"The Google Places API: Present and Future, from Sydney",2012-09-28T17:17:08Z,4552,34,5
Google Games Chat #5,2012-09-27T22:08:15Z,3026,46,0
Movilidad y el modelo de computación en la nube como el actual paradigma tecnológico,2012-09-27T20:49:55Z,1354,15,0
Google Drive App Review - Archy,2012-09-27T18:42:58Z,3465,33,0
"Apps Script Office Hours - September 27, 2012",2012-09-27T15:53:22Z,1175,11,0
Google+ Platform Office Hours (EMEA Edition): Devfest London & Hangouts,2012-09-27T13:22:44Z,1502,9,0
Plataforma social Google+ innovación para desarrolladores,2012-09-26T20:51:46Z,1161,15,0
YouTube Developers Live: New Ways to Showcase Your YouTube Apps,2012-09-26T17:35:55Z,1791,28,0
Chrome Apps Office Hours: Building Apps with Web Intents,2012-09-25T16:47:43Z,6001,69,1
Google Drive SDK: Writing your first Drive App in Go,2012-09-25T00:11:22Z,5641,46,0
Google Drive SDK: Writing your first Drive app in Ruby,2012-09-25T00:10:26Z,7274,39,0
BigQuery - Best Practices for Running Queries on Massive Datasets,2012-09-21T17:47:35Z,8556,64,1
"Apps Script Office Hours - September 20, 2012",2012-09-20T21:01:24Z,1341,15,0
Google Drive SDK: Writing your first Drive app in Java,2012-09-20T18:51:06Z,28988,88,16
Google Payments Live,2012-09-20T17:22:08Z,1458,22,0
Chrome Office Hours: Movi Kanti Revo—Behind the Divs,2012-09-20T16:33:05Z,11680,62,0
Content API for Shopping - Fireside Chat with Zazzle,2012-09-19T21:53:10Z,1462,12,0
