Video Title,Published Date,Views,Likes,Comments
"DevTools Eye Dropper Tool, Totally Tooling Tips (S1 Mini Tip #2)",2015-06-12T22:25:05Z,13627,142,13
Developer Announcements from Google: Coffee with a Googler,2015-06-12T21:05:23Z,1810,24,1
Chat with Alex Komoroske (Live from Google I/O 2015) - Coffee with a Googler,2015-06-12T21:05:11Z,1824,25,1
Coffee with a Googler: Chat with Sebastian Thrun (Live from Google I/O 2015),2015-06-12T21:04:56Z,3825,37,2
Coffee with a Googler: Chat with Macy Kuang (Live from Google I/O 2015),2015-06-12T21:04:24Z,1802,28,0
Google Play Announcements: Coffee with a Googler,2015-06-12T21:03:58Z,1732,22,5
What's coming with Google Now On Tap: Coffee with a Googler,2015-06-12T21:03:25Z,4430,59,2
Coffee with a Googler: Chat with David Singleton (Live from Google I/O 2015),2015-06-12T21:01:35Z,1342,10,1
"How I: Queue, cache, and test to build scalable apps (Part I)",2015-06-12T18:34:21Z,4996,50,5
Store Listing Experiments for Google Play  (100 Days of Google Dev),2015-06-12T16:40:34Z,33373,211,5
Google Play Games: Sign In Best Practices,2015-06-10T19:21:34Z,36887,288,19
Supercharging page load (100 Days of Google Dev),2015-06-10T16:59:29Z,111040,2851,68
Page load supercharge and Web Audio 808 synthesis -- LazyWeb #9,2015-06-09T20:56:36Z,12309,149,4
Google I/O 2015 Highlights,2015-06-09T18:59:03Z,32357,424,13
Mobile at #io15,2015-06-09T18:54:55Z,3667,77,2
Using LINT for Performance Tips (100 Days of Google Dev),2015-06-09T17:07:25Z,24227,223,4
MKBHD and Google Developer Advocate Timothy Jordan tour I/O,2015-06-08T19:10:44Z,23830,766,47
MapsZen - Seeing the Lite  (100 Days of Google Dev),2015-06-08T16:57:55Z,36364,143,6
Introduction to Voice Interaction API (100 Days of Google Dev),2015-06-07T16:39:48Z,76964,510,31
Introduction to Maps API on Android Wear (100 Days of Google Dev),2015-06-06T17:08:10Z,11627,71,1
"Quick Tip, majorRadius in UITouch (Route 85)",2015-06-06T00:45:53Z,7393,87,6
What's coming with Android M: Coffee with a Googler,2015-06-05T21:06:25Z,5266,75,8
Coffee with a Googler: Chat with Kelly Shuster (Live from Google I/O 2015),2015-06-05T21:06:11Z,3648,38,1
Coffee with a Googler: Chat with Aheri Stanford-Asiyo (Live from Google I/O 2015),2015-06-05T21:06:00Z,1915,20,1
Coffee with a Googler: Chat with Paul Lewis and Jake Archibald (Live from Google I/O 2015),2015-06-05T21:05:49Z,2276,40,7
Coffee With a Googler: Chat with Brian Grady (Live from Google I/O 2015),2015-06-05T21:05:32Z,4054,20,1
Coffee with a Googler: Chat with Jacquelyn Omotalade (Live from Google I/O 2015),2015-06-05T21:05:22Z,2036,20,8
Google Photos and Taking Control of your Digital Life: Coffee with a Googler,2015-06-05T21:05:12Z,3743,49,2
Made With Android: CasaDeBalloon.Club,2015-06-05T18:50:01Z,9276,270,9
Activity Recognition: Use low power sensors to detect user activity (100 Days of Google Dev),2015-06-05T16:59:53Z,49891,280,17
Code the Road: Logan Utah Recap,2015-06-04T21:56:59Z,14552,59,6
Google I/O: It ain't over 'til we say it's over,2015-06-04T19:26:54Z,5388,169,12
Learn Android development at your own pace,2015-06-04T17:56:34Z,6314,131,9
Push Notifications on the Open Web to increase engagement (100 Days of Google Dev),2015-06-04T17:07:32Z,42235,321,26
Code the Road: teaser one,2015-06-03T20:49:31Z,15250,42,7
Code the Road: I/O and San Francisco Recap,2015-06-03T20:49:22Z,2908,28,2
Introducing the Android Nanodegree,2015-06-03T18:52:22Z,39657,247,18
Google Play Services 7.5 (100 Days of Google Dev),2015-06-03T17:22:54Z,65650,360,24
"Debugging Promises with DevTools, Totally Tooling Tips (S1, Ep2)",2015-06-03T15:00:01Z,28209,254,29
Build your own Bootstrap -- LazyWeb #8,2015-06-02T21:06:29Z,18890,314,8
"Google I/O 2015 - Making apps context aware: Opportunities, tools, lessons and the future",2015-06-02T17:38:01Z,10552,112,5
The Magic of LRU Cache (100 Days of Google Dev),2015-06-02T17:09:10Z,92466,1245,26
Theming Elements -- Polycasts #17,2015-06-02T15:54:27Z,28565,235,55
Android Design Support Library (100 Days of Google Dev),2015-06-01T16:58:07Z,177515,1082,37
"HTTP 203: Build tools (S2, Ep2)",2015-06-01T15:00:01Z,16278,327,50
Google I/O 2015 - Engineering for the Stratosphere - Presented by Women Techmakers,2015-05-30T02:52:49Z,20892,147,7
Google I/O 2015 - Developing with Google on iOS,2015-05-30T02:48:07Z,12337,135,8
Google I/O 2015 - Democratizing Education,2015-05-30T02:43:24Z,21875,355,15
Google I/O 2015 - Android M Permissions,2015-05-30T00:00:27Z,39523,283,45
Google I/O 2015 - Developing for the living room with Google,2015-05-29T23:49:11Z,14254,71,5
Google I/O 2015 - Android Wear: Your app and the always-on screen,2015-05-29T23:43:53Z,11233,73,4
Google I/O 2015 - Ubiquitous Computing with Google,2015-05-29T23:37:52Z,14041,146,7
Google I/O 2015 - Developers connecting the world through Google Play,2015-05-29T23:32:26Z,10135,57,3
Google I/O 2015 - Improve your Android app's accessibility,2015-05-29T23:11:47Z,9833,97,6
Google I/O 2015 - What's new in Google Play services,2015-05-29T21:24:44Z,9707,80,10
An Introduction to CocoaPods (Route 85),2015-05-29T21:17:49Z,138440,2759,150
Google I/O 2015 - A little badass. Beautiful. Tech and human. Work and love. ATAP.,2015-05-29T21:11:53Z,198111,1574,101
Google I/O 2015 - Helping Moonshots Survive Contact with the Real World,2015-05-29T21:03:03Z,21586,227,11
Google I/O 2015 - Designing for virtual reality,2015-05-29T20:57:03Z,49606,399,20
Google I/O 2015 - Developing Extraordinary Apps with Firebase,2015-05-29T20:51:17Z,59321,350,42
Google I/O 2015 - Project Tango - Mobile 3D tracking and perception,2015-05-29T20:40:12Z,106691,616,42
"Google I/O 2015 - Tech for a better world, faster: A discussion with Google.org's social innovators",2015-05-29T20:33:01Z,8693,77,4
"Google I/O 2015 - Smarter user acquisition with App Indexing, AdWords and Google Analytics",2015-05-29T20:27:25Z,121098,112,5
Google I/O 2015 - Polymer and modern web APIs: In production at Google scale,2015-05-29T20:20:36Z,92970,861,35
Google I/O 2015 - Android Pay: The next generation of payments on Android,2015-05-29T17:16:13Z,32018,177,39
Google I/O 2015 - Material Now,2015-05-29T16:24:16Z,126968,1246,69
Google I/O 2015 - Growing games with Google,2015-05-29T16:16:13Z,9556,82,4
Fingerprint and payments APIs (100 Days of Google Dev),2015-05-29T16:07:34Z,158864,581,60
Google I/O 2015 - The next generation mobile web,2015-05-29T01:10:26Z,36747,224,34
Google I/O 2015 - Smarter monetization with AdMob and Analytics,2015-05-28T23:48:17Z,16718,127,8
Google I/O 2015 - What's New in Android Development Tools,2015-05-28T23:40:08Z,62627,431,30
Google I/O 2015 - What's new in Android,2015-05-28T23:03:40Z,116676,773,68
Google I/O 2015 - Google Cloud Messaging 3.0,2015-05-28T22:54:38Z,54892,252,19
Introducing the new family discovery experience on Google Play,2015-05-28T18:23:20Z,1798423,322,13
Angular 2 Tutorial and Sublime Text Tips -- LazyWeb #7,2015-05-26T21:00:01Z,25091,223,3
Chat with Francesc Campoy Flores about Go language - Coffee with a Googler,2015-05-22T21:08:23Z,14046,227,12
What theme is Addy using? Totally Tooling Tips (S1 Mini Tip #1),2015-05-22T15:00:00Z,22893,195,23
Launchpad Online: Ad Network Mediation,2015-05-21T21:50:23Z,6611,43,2
"Launchpad Online: Setting Goals, Forming the best strategy for you",2015-05-21T21:50:23Z,4310,21,2
Launchpad Online: Ads Ecosystem for App Developers,2015-05-21T21:50:23Z,7313,78,7
Launchpad Online: Understanding Mobile App Business Models,2015-05-21T21:50:22Z,36355,531,12
Launchpad Online: Ad Monetization with Google AdMob,2015-05-21T21:50:22Z,6786,31,3
Launchpad Online: AdMob + Google Analytics Integration,2015-05-21T21:50:22Z,3699,20,1
Launchpad Online: Getting started with AdMob,2015-05-21T21:50:22Z,15003,62,5
Android Wear: Always-On Apps,2015-05-21T17:03:58Z,29305,196,9
Tech Tips From Teachers: Introduction,2015-05-21T16:48:45Z,3273,16,0
Tech Tips From Teachers: Creation Tool Apps,2015-05-21T16:48:09Z,2264,17,2
Tech Tips From Teachers: Literacy Apps,2015-05-21T16:48:09Z,3225,29,3
Tech Tips From Teachers: Formative Assessment Apps,2015-05-21T16:48:08Z,22255,118,6
"Chrome 43: Cut and Copy, changes to DOM attributes & WebMIDI (New In Chrome - Ep 43)",2015-05-20T21:32:17Z,13869,204,28
"Sublime Text Plugins, Totally Tooling Tips (S1, Ep1)",2015-05-20T15:00:00Z,95608,1287,91
"Ember's new Glimmer engine, and Chrome Dev on Android - LazyWeb #6",2015-05-19T21:32:24Z,12809,180,4
Object Pools (Android Performance Patterns Season 2 ep5),2015-05-19T17:40:36Z,24159,275,7
Give your element an API -- Polycasts #16,2015-05-18T17:41:45Z,23426,245,36
"HTTP 203: Web Vs Native (S2, Ep1)",2015-05-18T16:00:06Z,19637,273,43
Chat with Greg Wilson about the Google Cloud Platform - Coffee with a Googler,2015-05-15T17:04:40Z,8276,99,3
HTTP 203: Season 2 Teaser,2015-05-15T16:55:09Z,8950,75,5
Chrome Dev Summit 2014 Highlights,2015-05-14T21:08:41Z,766664,68,3
Robot Fun at FIRST,2015-05-13T21:02:24Z,3696,57,2
How is TCP like the 7th grade? -- LazyWeb #5,2015-05-12T21:01:54Z,12597,235,9
"Chrome 42: Push API, App Install Banners & Fetch (New In Chrome - Ep 42)",2015-05-11T21:14:29Z,23188,275,13
Launchpad Online: Revolutionizing Email Access with the Gmail API,2015-05-08T17:10:48Z,79779,216,26
Chat with Ryan Troll about sign in and security - Coffee with a Googler,2015-05-08T17:05:28Z,6411,95,5
"Product Management in Tech with Alex Levich (Women Techmakers: Product Management Series, Episode 4)",2015-05-07T17:00:31Z,7114,81,6
"Product Management in Tech with Alex Levich (Women Techmakers: Product Management Series, Episode 3)",2015-05-06T21:23:35Z,7683,71,2
How hard is it to be a web developer? -- LazyWeb #4,2015-05-05T21:00:16Z,25759,379,18
Extending Native Elements -- Polycasts #15,2015-05-04T17:09:03Z,18934,166,23
Chat with Lauren Dale about Google I/O 15 - Coffee with a Googler,2015-05-01T21:30:00Z,6751,84,11
"Debugging and testing in Android Studio (Ep 4, Android Studio)",2015-05-01T17:34:14Z,76124,420,13
"Product Management in Tech with Alex Levich (Women Techmakers: Product Management Series, Episode 2)",2015-04-30T20:59:16Z,6300,71,3
How I: Build one-pagers to get investment meetings,2015-04-30T17:21:53Z,28425,314,12
Sky: An Experiment Writing Dart for Mobile (Dart Developer Summit 2015),2015-04-30T04:46:42Z,108069,667,69
Dart for Mobile  (Dart Developer Summit 2015),2015-04-30T03:57:11Z,13747,112,16
Moving from Node.js to Dart  (Dart Developer Summit 2015),2015-04-30T02:33:11Z,38697,365,34
Dart for the Internet of Things  (Dart Developer Summit 2015),2015-04-30T02:06:51Z,8156,89,2
Google Fiber and Dart (Dart Developer Summit 2015),2015-04-30T00:05:10Z,2765,38,0
Panel with Dart Engineers (Dart Developer Summit 2015),2015-04-29T23:23:02Z,2442,26,0
Building Production Dart Apps with an Open Source Workflow (Dart Developer Summit 2015),2015-04-29T22:08:50Z,2680,24,1
How We Built Instill.io With Dart and Polymer (Dart Developer Summit 2015),2015-04-29T20:27:45Z,3986,25,4
Keynote: Ads and Dart (Dart Developer Summit 2015),2015-04-29T19:42:01Z,1957,16,1
"Product Management in Tech with Alex Levich (Women Techmakers: Product Management Series, Episode 1)",2015-04-29T18:15:22Z,11168,210,3
Chat with Magnus Hyttsten - Coffee with a Googler,2015-04-29T17:09:59Z,4960,74,11
Migrating Trustwave's Large Customer Portal to Dart (Dart Developer Summit 2015),2015-04-29T16:24:33Z,2015,20,0
Switching to Dart: Faster Development for Workiva (Dart Developer Summit 2015),2015-04-29T02:22:28Z,6667,66,1
Getting the Most Out of Dart2js (Dart Developer Summit 2015),2015-04-29T02:01:41Z,3414,33,3
Dart for the Web: State of the Union (Dart Developer Summit 2015),2015-04-29T01:33:09Z,4337,45,1
Debugging and Profiling Dart Programs with Observatory (Dart Developer Summit 2015),2015-04-28T23:14:31Z,9972,92,2
Space Frugal Reflection (Dart Developer Summit 2015),2015-04-28T21:56:22Z,2842,24,6
Dart at 60fps  (Dart Developer Summit 2015),2015-04-28T21:16:17Z,7668,85,6
Push notifications for the web -- LazyWeb #3,2015-04-28T21:12:27Z,30358,254,6
Async in Dart  (Dart Developer Summit 2015),2015-04-28T19:46:23Z,15122,184,4
Keynote: Dart Today & Tomorrow  (Dart Developer Summit 2015),2015-04-28T19:04:49Z,14437,98,5
DevBytes: Google Play Services 7.3,2015-04-28T17:03:43Z,34600,329,24
Android Wear Data Batching (Android Performance Patterns Season 2 ep4),2015-04-23T19:22:32Z,7591,46,1
Wear & Sensors (Android Performance Patterns Season 2 ep2),2015-04-23T19:21:20Z,22590,171,11
Smooth Android Wear Animation (Android Performance Patterns Season 2 ep3),2015-04-23T19:21:19Z,13868,92,3
Map Tips: Get Started with Autocomplete,2015-04-21T23:07:26Z,20650,56,2
Android Support Library: Consistent Design with AppCompat,2015-04-21T21:19:26Z,67613,956,50
A quest to save the universe with JavaScript -- LazyWeb #2,2015-04-21T20:57:24Z,10577,189,14
Project Tango concepts - DevBytes,2015-04-21T16:25:33Z,26610,144,6
Create reusable elements with ease -- Polycasts #14,2015-04-21T16:01:57Z,18089,151,97
Introduction to planetary-scale geospatial analysis with Google Earth Engine,2015-04-17T22:51:47Z,31495,302,8
Chat with Adriana Cerundolo about Google Developer Groups - Coffee with a Googler,2015-04-17T21:13:47Z,6192,78,20
"Kids, Robots, and a passion for Science",2015-04-17T17:39:17Z,14436,95,4
How We: Use pilot tests and Android sensors to democratize science,2015-04-16T17:48:53Z,4980,45,3
The physical web is all around us -- LazyWeb #1,2015-04-14T21:37:56Z,13307,250,21
Chat with Colt McAnlis - Coffee with a Googler,2015-04-10T17:28:46Z,7965,157,24
How I: Build open platforms on Android,2015-04-09T17:12:54Z,5562,38,0
Getting more from Santa with deep links,2015-04-07T17:38:41Z,11186,99,5
Sun Surveyor brings augmented reality to photographers using Google Maps APIs,2015-04-07T16:23:38Z,109360,184,12
Chat with Katherine Kuan about Udacity courses - Coffee with a Googler,2015-04-03T17:21:28Z,16905,355,19
How I: Use events to build DeadSocial's brand,2015-04-02T21:07:50Z,3397,13,1
主题演讲 Chris Yerga,2015-04-02T19:26:45Z,1953,10,3
Panel with Googlers Apps track,2015-04-02T19:26:10Z,383,0,0
Go global with Google Play,2015-04-02T19:22:53Z,691,3,3
在Google上营利 Brahim Elbouchikhi,2015-04-02T19:15:17Z,929,8,0
Google Play 上有关游戏的服务介绍 Tony Chan,2015-04-02T18:59:54Z,710,3,0
Google speaker Panel,2015-04-02T18:57:01Z,840,2,0
应用的可发现性和如何获得更多用户 Kevin Chiao & Tianshi Gao,2015-04-02T18:42:10Z,659,4,0
谷歌开发技术生态系统和资源介绍 Bill Luan,2015-04-02T18:39:13Z,853,7,0
Games track Googlers panel,2015-04-02T18:35:36Z,256,0,0
开发者支持的运营和政策 Dana Yang,2015-04-02T18:30:14Z,561,8,0
应用开发 Michael Yeung,2015-04-02T18:24:23Z,835,6,2
如何成功地开发你的应用 Ellie Powers,2015-04-02T18:21:35Z,1136,4,2
Playtime Shanghai event sizzle reel,2015-04-02T18:17:05Z,3304,10,1
Android Support Library Overview,2015-03-30T19:26:30Z,36376,344,23
How Google does shadows on iOS (Route 85),2015-03-27T21:12:51Z,18281,385,14
Chat with Scott Jenson about the Physical Web - Coffee with a Googler,2015-03-27T17:03:56Z,9022,156,17
A big Reddit THANK YOU from Colt McAnils,2015-03-27T16:37:41Z,3214,42,2
Android iBeacon notification (Italian),2015-03-25T18:03:45Z,6978,38,5
"Layout Editor (Ep 3, Android Studio)",2015-03-25T17:16:58Z,60642,310,13
Women Techmakers Summit 2015: Embracing the Uncomfortable featuring Avni Shah,2015-03-23T20:46:44Z,5947,73,3
Women Techmakers Summit 2015: Stretch.Lift.Make featuring Pavni Diwanji,2015-03-23T20:45:49Z,1000,14,1
Women Techmakers Summit 2015: Pay it Forward - Women and Technology featuring Telle Whitney,2015-03-23T20:45:49Z,344,1,0
Women Techmakers Summit 2015: Creating a Movement featuring Julie Pearl and Alaina Percival,2015-03-23T20:45:49Z,1942,8,0
Women Techmakers Summit 2015: Rapid Innovation,2015-03-23T20:45:48Z,1798,10,1
Women Techmakers Summit 2015: Opening Remarks featuring Suzanne Frey,2015-03-23T20:45:48Z,1051,3,0
Women Techmakers Summit 2015: Thank You featuring Natalie Villalobos,2015-03-23T20:45:48Z,966,9,0
Launchpad Online: Getting started with Google Analytics,2015-03-23T15:56:16Z,8911,34,1
Launchpad Online: Customizing Google Analytics for your startup,2015-03-23T15:52:02Z,4853,22,0
Compressor Head - Behind the Scenes,2015-03-20T18:14:07Z,7309,130,15
Chat with Michelle Haq about the Google Fit platform - Coffee with a Googler,2015-03-20T17:58:04Z,6375,61,9
Going Places on Android,2015-03-19T22:44:16Z,17955,124,2
Google Play Services 7.0,2015-03-19T22:29:49Z,25789,252,24
Women Techmakers presents Lakshya Sivaramakrishnan: My Journey with Technology,2015-03-18T23:10:11Z,4015,78,7
How I: Drive engagement with social challenges,2015-03-18T21:22:14Z,2949,20,2
"Women Techmakers presents Hariny Murli: It's Not Where You Are, It's What You Do Best",2015-03-17T16:38:58Z,7328,163,8
Women Techmakers presents Rani Paruchuri: My Long Story in Short,2015-03-17T16:12:12Z,2771,70,7
Connect. Create. Celebrate - Women Techmakers Summit 2015,2015-03-13T20:58:01Z,5486,55,5
Android Performance Patterns: Memory Churn and Performance,2015-03-13T20:15:56Z,22593,256,10
"Introducing Gradle (Ep 2, Android Studio)",2015-03-13T18:10:42Z,105353,760,29
Making Mobile Games More Magnificent,2015-03-13T17:32:34Z,5203,44,3
Running a Successful Games Business with Google,2015-03-13T17:32:15Z,4061,62,0
"Dynamic Statistical Encoding (Ep 6, Compressor Head) Google",2015-03-13T17:08:10Z,9977,223,19
Lightning Talk: Unlocking Global by Going Local,2015-03-12T18:12:49Z,2537,27,0
Lightning Talk: How to Go Viral Without Really Trying,2015-03-12T18:12:49Z,4368,28,3
Lightning Talk: Games for Google Cast,2015-03-12T18:12:48Z,2462,32,1
Lightning Talk: An Overview of Project Tango,2015-03-12T18:12:48Z,2628,36,2
Lightning Talk: Play Game Services Player Analytics,2015-03-12T18:12:48Z,1160,13,1
Lightning Talk: The AdMob Accelerator Plan,2015-03-12T18:12:48Z,1394,14,0
Lightning Talk: Top 10 Things Android Game Developers Should Know v 3.0,2015-03-12T18:12:48Z,3339,91,0
Lightning Talk: Automate Publishing for Google Play APIs,2015-03-12T18:12:48Z,2476,21,0
Lightning Talk: Dual Cubic Splines,2015-03-12T18:12:47Z,2379,42,0
Lightning Talk: DeNA and BigQuery,2015-03-12T18:12:47Z,5078,29,4
Lightning Talk: Bite-Sized VR,2015-03-12T18:12:47Z,765,8,0
Lightning Talk: The Seven Sins of Android Game Developers,2015-03-12T18:12:47Z,1917,13,0
Lightning Talk: FlatBuffers,2015-03-12T18:12:47Z,20217,302,4
Lightning Talk: Android TV,2015-03-12T18:12:47Z,3473,15,1
Lightning Talk: 3 Game Design Mistakes You're Making,2015-03-12T18:12:46Z,13310,411,12
How I: Use BigQuery to visualize streaming data,2015-03-12T16:01:40Z,4885,17,0
Android Performance Patterns: Garbage Collection in Android,2015-03-11T19:33:10Z,35831,480,9
Women Techmakers presents Elena Kon: Embracing Failure,2015-03-11T18:41:51Z,35765,49,5
Women Techmakers presents Kathy Pham: Falling in Love with Computer Science,2015-03-10T21:34:10Z,3112,59,1
"#DearMe: Pavni Diwanji, VP of Engineering - Google for Kids",2015-03-10T21:31:50Z,2376,28,3
"How I: Find, screen, and hire developers",2015-03-06T21:41:15Z,32726,467,21
Chat with Fred Chung about developer advocacy - Coffee with a Googler,2015-03-06T21:17:07Z,7048,100,10
"Arithmetic Compression (Ep 5, Compressor Head) Google",2015-03-06T18:53:52Z,18309,477,28
Introducing the Google Maps Platform Roads API,2015-03-04T21:00:11Z,100507,175,24
"Google Root Access: What we learned building plug-ins for Android, with startup Magnet",2015-03-02T22:13:53Z,4301,27,2
Android TV: Beach Buggy Racing Multiplayer with Nearby Connections (Play Services),2015-03-02T18:06:06Z,754196,5159,284
Chat with Allen Huang of AndroidTV - Coffee with a Googler,2015-02-27T19:40:51Z,6610,81,8
"Burrows-Wheeler Transform (Ep 4, Compressor Head) Google",2015-02-27T16:53:37Z,31878,798,49
Android TV: Introduction to Android TV,2015-02-26T19:31:28Z,20342,137,4
Android TV: Global Search,2015-02-26T19:31:28Z,8611,52,1
How I: Use URL builder to measure ROI on social media,2015-02-26T18:03:39Z,4139,25,3
Get more engaged users with Google Search for Developers,2015-02-26T16:58:51Z,5282,70,5
Game On! - Pie Noon,2015-02-25T22:17:03Z,7711,129,4
"Compressor Head -  The Trailer, Season 2",2015-02-24T02:22:58Z,6675,119,10
Introduction to Android Studio,2015-02-23T18:49:15Z,165212,1343,56
"Google Root Access: 3 ways to get developers to buy into your platform, with startup Magnet",2015-02-21T02:47:10Z,4055,39,2
Google Developers Channel Trailer,2015-02-14T00:44:03Z,68726,208,27
How I: Validated my idea in 2 days (with no code),2015-02-12T22:53:56Z,54076,842,17
GDELT & BigQuery: Understand the world,2015-02-12T17:35:51Z,22958,276,16
Launchpad Online: Accessing Google Maps from a spreadsheet?!?,2015-02-06T22:34:37Z,45950,382,67
"More Pixels, More Problems (Route 85)",2015-02-06T19:58:31Z,7613,204,9
How I: Test beta-product features using Google Apps,2015-02-05T19:57:42Z,5875,62,1
"Polymer, elementi per il layout [Italiano]",2015-01-22T00:09:26Z,4040,26,2
I/O Extended 2014 - Join me,2015-01-21T23:49:34Z,7723,146,11
"Polymer, attributi per il layout [Italiano]",2015-01-21T23:14:53Z,2559,21,0
How I: Prep to fundraise with four questions,2015-01-21T22:27:40Z,3722,80,8
Introducing Google Cloud Platform Resources,2015-01-21T22:24:57Z,19404,102,5
Quick Tip: Don't Default that Switch! (Route 85),2015-01-16T17:29:21Z,9267,163,18
GDG Happy New Year 2015,2015-01-15T19:06:46Z,1327,20,9
"HTTP 203: Gotchas (S1, Ep6)",2015-01-12T17:14:53Z,12621,202,21
Game On! - Meet the Management APIs,2015-01-09T21:28:12Z,10581,84,11
Easy Maps Apps in Java and Python,2015-01-07T22:23:29Z,66052,425,22
How I: Use a common code repo to pivot quickly,2015-01-07T17:58:53Z,6700,103,7
Android Performance Patterns: Tool - Memory Monitor,2015-01-06T19:33:30Z,39748,241,6
Android Performance Patterns: Understanding VSYNC,2015-01-06T19:33:28Z,49921,613,13
Android Performance Patterns: Understanding Overdraw,2015-01-06T19:33:27Z,33793,357,9
Android Performance Patterns: Android UI and the GPU,2015-01-06T19:33:27Z,40963,449,6
Android Performance Patterns: Why 60fps?,2015-01-06T19:33:26Z,82270,1020,42
Android Performance Patterns: Rendering Performance 101,2015-01-06T19:33:25Z,76079,598,9
Google Developers,2014-12-30T22:15:58Z,46649,284,16
Women Techmakers presents Jennifer Pahlka interviewed by Steph Hannon,2014-12-23T00:08:54Z,5162,65,7
GDE Community Experiences Hernán Liendo Step 4 [spanish],2014-12-20T15:15:54Z,1062,11,0
Density-independent Pixels [Thai],2014-12-20T01:03:27Z,2949,80,4
Chat with Francis Ma about Google Play services - Coffee with a Googler,2014-12-19T23:35:57Z,15522,164,20
"OpenInChrome on iOS, Part 4 (Route 85)",2014-12-18T22:39:04Z,3127,49,14
"OpenInChrome on iOS, Part 3 (Route 85)",2014-12-18T22:38:51Z,2354,34,3
"OpenInChrome on iOS, Part 2 (Route 85)",2014-12-18T22:38:33Z,2740,44,1
"OpenInChrome on iOS, Part 1(Route 85)",2014-12-18T22:38:16Z,7272,86,7
"HTTP 203: Christmas Special (S1, Ep5)",2014-12-18T17:32:04Z,9015,118,12
Android Vector Graphics in Android 5.0 Lollipop,2014-12-17T23:18:04Z,81776,765,46
How I: Use paper wireframing to build native prototypes,2014-12-17T22:49:00Z,19496,194,9
DevBytes: Web Components - HTML Imports,2014-12-17T19:17:06Z,26852,212,21
Change the world in 10 lines of code,2014-12-16T18:21:45Z,24291,268,6
Another Google (Apps) secret?,2014-12-16T18:19:17Z,82477,472,17
Launchpad Online: Creating great experiences with email markup,2014-12-16T18:18:36Z,25886,129,10
Introducing Route 85,2014-12-12T22:44:13Z,30881,433,32
How I: Write press releases to get international media coverage,2014-12-11T19:43:32Z,95110,3677,38
Google Cast: Introduction to the SDK,2014-12-10T23:25:39Z,48581,149,15
Google Play Services 6.5,2014-12-08T19:33:25Z,25629,490,34
"HTTP 203: Font Rendering (S1, Ep4)",2014-12-04T17:52:05Z,15305,187,9
Announcement: Google Developer content is now available offline,2014-12-03T01:20:24Z,6408,111,15
"Google Root Access: How to overcome customer objections when selling tech, with startup Guesswork",2014-12-02T17:30:18Z,3239,30,7
"Google Root Access: How to use machine-learning for business success, with startup Guesswork",2014-12-02T17:29:59Z,4345,48,1
The passion of Google development in Udacity with spanish subtitles [spanish],2014-11-27T18:31:37Z,2143,14,0
Continuous learning with Google in Udacity with spanish subtitles [spanish],2014-11-27T18:31:37Z,2660,14,4
"Devoxx 2014 Interviews: Docker, Kubernetes & GKE",2014-11-27T17:07:56Z,3168,21,1
Devoxx 2014 Interviews: Google Managed VMs,2014-11-27T14:07:41Z,1822,7,0
"Devoxx 2014 Interviews: Guava, Dagger 2 and Truth",2014-11-27T14:07:31Z,2861,27,1
Devoxx 2014 Interviews: Android Wear,2014-11-27T14:07:20Z,1987,21,0
Devoxx 2014 Interviews: Google Cloud Dataflow,2014-11-27T14:07:10Z,1692,14,1
Devoxx 2014 Interviews: Intro to Polymer,2014-11-27T14:07:02Z,1380,11,0
Devoxx 2014 Interviews: Mobile Chrome Apps,2014-11-27T14:06:47Z,1030,12,2
"Devoxx 2014 Interviews: AutoValue, Annotation Processing, and Dagger 2",2014-11-27T14:06:39Z,1541,17,0
Devoxx 2014 Interviews: BigQuery and user-defined functions,2014-11-27T14:06:24Z,1001,5,1
Devoxx 2014 Interviews: Android Tools,2014-11-27T14:06:15Z,1544,25,1
Devoxx 2014 Interviews: Firebase for mobile clients,2014-11-27T14:06:06Z,960,8,0
Devoxx 2014 Interviews: Material Design for developers,2014-11-27T14:05:57Z,2292,20,1
Devoxx 2014 Interviews: What's new in Android 5.0 Lollipop,2014-11-27T14:05:47Z,2438,19,6
GDE Community Experiences  Hernán Liendo  Step 3 [spanish],2014-11-26T20:07:12Z,757,10,0
Background Blend Modes [Italiano],2014-11-26T17:31:35Z,798,11,0
Material Design panel - Chrome Dev Summit 2014,2014-11-22T20:50:16Z,6781,70,7
Chrome Leadership panel - Chrome Dev Summit 2014,2014-11-22T20:50:08Z,2351,12,0
Performance Panel - Chrome Dev Summit 2014,2014-11-22T20:50:00Z,2584,28,0
Future of Apps Panel - Chrome Dev Summit 2014,2014-11-22T20:49:15Z,2447,20,2
Web Components and Polymer Panel - Chrome Dev Summit 2014,2014-11-22T20:48:53Z,3881,36,1
