Video Title,Published Date,Views,Likes,Comments
"Android Game SDK, ARCore Depth API, Google Summer of Code 2020, & more!",2019-12-12T22:00:02Z,18921,581,19
Flutter Interact 2019 Top 5 Recap,2019-12-12T00:05:22Z,725861,908,24
Blending realities with the ARCore Depth API - Deep Dive,2019-12-09T17:00:32Z,245745,6198,299
"Mendel Linux 4.0, Advanced Android with Kotlin, Stackdriver Logging, & more!",2019-12-05T22:57:13Z,10334,305,10
Don’t miss #AskFlutter live at Flutter Interact ‘19!,2019-11-28T00:04:23Z,61067,247,80
Developer Student Clubs 2019 India Leads Summit,2019-11-27T16:00:00Z,21622,734,17
Sizzle - GDE Summit 2019,2019-11-26T00:09:59Z,6891,181,5
Closing remarks - Pittsburgh ML Summit ‘19,2019-11-23T00:49:58Z,632,14,0
Panel discussion - Pittsburgh ML Summit ‘19,2019-11-23T00:48:00Z,586,6,0
Vizier: Black-box optimization and AutoML - Pittsburgh ML Summit ‘19,2019-11-23T00:45:03Z,3732,79,0
Convolutional neural networks with Swift - Pittsburgh ML Summit ‘19,2019-11-23T00:42:55Z,1541,16,0
Serverless & AI/ML - Pittsburgh ML Summit ‘19,2019-11-23T00:40:18Z,560,8,0
Inclusive AI - Pittsburgh ML Summit ‘19,2019-11-23T00:37:47Z,704,10,0
The future of Mobile Learning - Pittsburgh ML Summit ‘19,2019-11-23T00:35:27Z,1355,16,1
Neural Query Language - Pittsburgh ML Summit ‘19,2019-11-23T00:32:52Z,337,8,1
Code-Free probing of Machine Learning models - Pittsburgh ML Summit ‘19,2019-11-23T00:28:45Z,956,17,0
Art + AI - Pittsburgh ML Summit ‘19,2019-11-23T00:25:26Z,667,11,0
Reinforcement Learning with TensorFlow and Unity - Pittsburgh ML Summit ‘19,2019-11-23T00:20:04Z,5825,117,3
Conversation AI - Pittsburgh ML Summit ‘19,2019-11-23T00:14:14Z,586,14,0
Welcome from Google Developers - Pittsburgh ML Summit ‘19,2019-11-23T00:11:29Z,4479,94,3
"Sign in with Apple for Firebase Authentication, Go Language turns 10, & much more!",2019-11-21T22:09:32Z,8313,224,13
Developer Student Clubs 2019 Pakistan Leads Summit,2019-11-21T17:00:08Z,11896,458,27
Highlights - Kirkland ML Summit ‘19,2019-11-19T20:38:00Z,521,18,0
Panel discussion - Kirkland ML Summit ‘19,2019-11-19T20:36:01Z,393,10,0
Convolutional neural networks with Swift - Kirkland ML Summit ‘19,2019-11-19T20:34:12Z,1811,23,1
TensorFlow 2.0: Transitioning to production - Kirkland ML Summit ‘19,2019-11-19T20:32:36Z,486,4,0
Using AI for accessibility & customization by voice - Kirkland ML Summit ‘19,2019-11-19T20:30:39Z,689,13,0
Deep learning for robot navigation - Kirkland ML Summit ‘19,2019-11-19T20:28:41Z,4198,73,0
Ease ML deployments with TensorFlow Serving - Kirkland ML Summit ‘19,2019-11-19T20:26:38Z,4171,123,3
Building data foundation for ML - Kirkland ML Summit ‘19,2019-11-19T20:25:01Z,446,4,0
Feature engineering in BigQuery and TensorFlow 2.0/Keras - Kirkland ML Summit ‘19,2019-11-19T20:22:55Z,1512,38,1
"Face detection, tracking, and redaction using deep neural networks - Kirkland ML Summit ‘19",2019-11-19T20:21:17Z,5163,69,0
Embedding-based classifiers for large output spaces - Kirkland ML Summit ‘19,2019-11-19T20:17:41Z,1335,24,0
Welcome from the Google Developers team - Kirkland ML Summit ‘19,2019-11-19T20:16:41Z,4347,86,2
Take the Flutter Clock challenge,2019-11-18T20:04:39Z,18568,396,23
My GDE journey - Joe Birch,2019-11-16T00:56:32Z,9152,245,5
Top 5 from the Chrome Dev Summit 2019,2019-11-15T19:47:20Z,4982,151,5
"Google Play Points, open sourcing Cardboard, OpenTitan, & more!",2019-11-14T22:48:45Z,12186,419,10
Nazirini’s story - using machine learning to tackle crop disease,2019-11-13T17:02:26Z,54675,1497,66
"Biometric API, TensorFlow Enterprise, Chrome 79 Beta, & more!",2019-11-07T22:37:10Z,9124,371,11
Highlights - Cambridge ML Summit '19,2019-11-06T23:37:31Z,752,13,0
Google Code-in: Become a Mentor!,2019-11-06T21:20:11Z,5531,145,5
Basics of Google Code-in,2019-11-06T21:20:07Z,17429,254,11
Why Students Participate in Google Code-in,2019-11-06T21:19:45Z,4832,115,4
Closing remarks - Cambridge ML Summit ‘19,2019-11-01T23:39:29Z,488,11,0
Panel discussion - Cambridge ML Summit ‘19,2019-11-01T23:37:01Z,533,5,0
Fusing AI + AR on Android  - Cambridge ML Summit ‘19,2019-11-01T23:34:36Z,3818,79,2
Protein function prediction using neural networks | Google Developers ML Summit 2019,2019-11-01T23:32:08Z,10434,213,8
Art and AI - Cambridge ML Summit ‘19,2019-11-01T23:29:32Z,697,29,1
Bringing machine learning to the web and beyond - Cambridge ML Summit ‘19,2019-11-01T23:27:02Z,1433,22,1
Empowering businesses to realize impact with AI - Cambridge ML Summit ‘19,2019-11-01T23:23:51Z,334,8,1
A deep neural network - Cambridge ML Summit ‘19,2019-11-01T23:21:11Z,476,15,2
Building a language toxicity classification - Cambridge ML Summit ‘19,2019-11-01T23:18:45Z,395,6,0
Using natural language processing - Cambridge ML Summit ‘19,2019-11-01T23:15:46Z,1407,29,2
The What-If tool - Cambridge ML Summit ‘19,2019-11-01T23:13:06Z,2908,50,1
ML Fairness - Cambridge ML Summit ‘19,2019-11-01T23:10:47Z,831,9,0
Ease ML deployments with TensorFlow Serving  - Cambridge ML Summit ‘19,2019-11-01T23:07:40Z,7871,220,12
Learning the depths of moving people by watching frozen people  - Cambridge ML Summit ‘19,2019-11-01T23:05:16Z,1110,20,0
Welcome - Cambridge ML Summit ‘19,2019-11-01T23:01:17Z,6496,103,0
Google.dev @ Firebase Summit,2019-11-01T21:59:47Z,526,15,1
"Android Developer Challenge, Google Maps Platform, New in Chrome 78",2019-10-31T21:00:12Z,7863,289,13
Developer Student Clubs 2019 Paris Leads Summit,2019-10-30T16:17:53Z,5672,220,9
Top 5 from the Android Dev Summit 2019,2019-10-28T22:40:10Z,6995,267,7
"Android NDK r21, Security Health Analytics for GCP, Bazel 1.0",2019-10-24T21:42:02Z,6656,203,12
Amey learns to create a low-cost hearing aid with Android,2019-10-21T23:01:44Z,19973,896,43
Developing Accessible Routes for Google Maps,2019-10-21T16:04:06Z,13829,592,21
"#AndroidDevSummit, architecting on Google Cloud, Google Code-in 2019 Org, & more!",2019-10-17T22:08:26Z,8203,304,12
Developer Student Clubs 2019 South East Asia Leads Summit,2019-10-15T17:24:41Z,8003,263,16
"Android Emulator tools, updates to AutoML Vision Edge, AutoML Video, & Video Intelligence API",2019-10-10T21:35:57Z,12560,422,8
"Google Play Pass, DevFest, Firebase Summit ‘19, & more!",2019-10-03T22:29:35Z,11326,338,15
Thinking in 5G (Google I/O'19),2019-10-01T23:15:02Z,7003,137,7
Top 5 from the Firebase Summit 2019,2019-10-01T19:01:25Z,7156,180,7
Developer Student Clubs Solution Challenge 2019,2019-09-30T23:23:26Z,13960,381,5
Why Fluz chose a .app domain name,2019-09-30T07:00:05Z,2422,27,3
Why the Node.js team launched a .dev domain,2019-09-30T07:00:03Z,4269,67,4
How encryption and HSTS preloading protect websites,2019-09-30T07:00:02Z,11690,143,2
Why Skinary chose a .app domain name,2019-09-30T07:00:02Z,5690,53,1
"Android Kotlin codelab courses, Firebase Realtime Database, Chrome 78 Beta, & more!",2019-09-26T21:39:33Z,10559,465,9
Introduction to Firebase - NA DSC Summit,2019-09-25T18:22:15Z,943,22,2
Engineering your career path - NA DSC Summit,2019-09-25T18:19:58Z,517,7,3
Introduction to CS First & Code.org - NA DSC Summit,2019-09-25T18:17:22Z,664,5,2
The DMZ - NA DSC Summit,2019-09-25T18:10:14Z,236,3,1
NEXT Canada - NA DSC Summit,2019-09-25T18:07:22Z,280,6,0
Intro to Flutter - NA DSC Summit,2019-09-25T17:53:41Z,1358,39,6
"Blood, sweat, and tears - NA DSC Summit",2019-09-25T17:50:16Z,466,15,1
DSC around the world - NA DSC Summit,2019-09-25T17:46:32Z,1638,36,2
Opening remarks - NA DSC Summit,2019-09-25T17:44:09Z,574,13,1
Event recap - DSC Summit Canada 2019,2019-09-25T17:40:13Z,5417,126,6
"ARCore updates, New in Chrome 77, Announcing Dart 2.5",2019-09-19T21:39:39Z,9105,374,6
How is Flutter different for app development,2019-09-17T19:11:50Z,280148,5238,221
"Welcoming Android 10, Flutter 1.9, AI Hub update, & more!",2019-09-12T21:19:52Z,18915,764,18
"Introduction to ARCore Augmented Faces, iOS",2019-09-12T16:04:33Z,15101,132,8
"Introduction to ARCore Augmented Faces, Android",2019-09-12T16:04:23Z,30617,277,14
"Introduction to ARCore Augmented Faces, Unity",2019-09-12T16:04:08Z,60861,1332,63
Google I/O'19 - Eve Ekman & William Russell Interview,2019-09-09T21:21:51Z,23903,202,2
"Checksum Database, Simplified Publisher Experience, & more!",2019-09-05T21:30:41Z,11592,380,12
"Android Studio 3.5, Cloud Run Button, BigQuery Terraform module",2019-08-29T21:00:36Z,11512,464,11
"Google I/O app source code, Chrome 77 Beta, & OpenCensus Web",2019-08-22T21:00:06Z,11287,397,9
"Android Q Beta 6, Coral updates, Contact Picker for the web",2019-08-15T22:10:45Z,15662,481,20
Eko Wahyudi's Story - Udacity Scholarship,2019-08-13T17:00:03Z,8499,369,14
"New Google Play Console Data, GCP Database Options, Chrome 76, & more!",2019-08-08T22:03:43Z,12010,407,20
"Cloud Functions triggers, Flutter for web, & Chrome 77 DevTools",2019-08-01T22:53:58Z,12875,436,8
"Android Dev Summit, Web Components v1 APIs, & bigger rewards for security bugs!",2019-07-26T18:15:03Z,10099,350,10
"Android Q Beta 5, Flutter 1.7, & Cloud TPU Pods",2019-07-18T21:29:28Z,21667,695,26
"Local Home SDK, Cloud Tasks, & Truth 1.0",2019-07-11T21:37:16Z,9229,284,8
"Google Cloud Data Catalog, YouTube-8M Segments, & Deep Learning Containers",2019-07-04T16:00:06Z,13724,347,9
Kotlin/Everywhere Teaser 2,2019-07-02T15:00:01Z,12523,287,18
The Google Developers Experts Program,2019-06-28T15:00:09Z,55308,1200,40
"Google Pay/Paypal integration, App Engine updates, & more!",2019-06-27T22:42:28Z,11913,343,15
Developer Student Club in Ghana creates AR navigation app for their local mall,2019-06-26T17:00:03Z,19446,730,46
"Android Studio 64-bit, Google Cloud Certified, Chrome 76 Beta, & more!",2019-06-20T23:25:24Z,18413,619,25
"#HowICode: Never deploy on a Friday, Grace Fairhill",2019-06-14T16:00:51Z,16748,316,17
"Android Q Beta 4, Google Research Football, & Chrome 75",2019-06-13T22:30:43Z,12749,428,23
Explore Google Accessibility at I/O with Hastu,2019-06-10T20:00:02Z,6980,337,15
"Coral updates, Chrome 76 DevTools, & Cloud Scheduler",2019-06-06T21:46:02Z,12590,397,9
"Wide Color Photos on Android, Cloud Audit Logs, & more!",2019-05-30T21:00:26Z,8133,249,7
#HowICode Rubber Duck Debugging,2019-05-28T23:38:26Z,26113,400,15
"Kotlin/Everywhere, Android Dark Theme in Flutter, & Kubernetes apps",2019-05-23T21:15:20Z,17802,640,24
Tour of Assistant Sandbox at IO 2019,2019-05-22T23:43:10Z,6914,196,14
Google I/O'19 - Mae C. Jemison Interview,2019-05-21T17:52:16Z,6833,108,7
Google Developer Student Clubs,2019-05-18T00:00:00Z,84512,2362,74
"New in Android Jetpack, Android Studio 3.5 Beta, Flutter, & more!",2019-05-16T21:51:25Z,15192,499,18
Designing for Accessibility (Google I/O'19),2019-05-16T17:51:46Z,7743,112,3
#HowICode Metaphors To Problem Solve,2019-05-14T23:00:06Z,15228,354,9
Sonic Boom! Audio Programming on Android and Chrome (Google I/O'19),2019-05-14T18:55:57Z,12624,286,12
Local Technologies for the Smart Home (Google I/O'19),2019-05-13T18:47:54Z,13113,125,5
Google I/O'19 - I/O Live (Day 3 Composite),2019-05-11T00:57:05Z,1353,14,1
Google I/O'19 - I/O Live (Day 2  Composite),2019-05-11T00:54:10Z,1263,13,0
Google I/O'19 - I/O Live (Day 1 Composite),2019-05-11T00:50:03Z,1542,11,0
Google I/O'19 - Wrap-up and highlights from I/O'19,2019-05-11T00:44:20Z,1941,22,0
Google I/O'19 - Welcome to I/O'19,2019-05-11T00:41:24Z,2524,15,0
Google I/O'19 - Yossi Matias Interview,2019-05-10T23:53:50Z,829,9,0
Google I/O'19 - Sougwen Chung Interview,2019-05-10T23:52:16Z,2200,41,1
Google I/O'19 - Firebase: Improve Your App,2019-05-10T23:50:38Z,1073,22,0
Google I/O'19 - Firebase: MechaHamster,2019-05-10T23:48:39Z,772,10,3
Google I/O'19 - AR: Espresso & Mars Rover,2019-05-10T23:46:24Z,764,14,1
Google I/O'19 - After Dark Tour,2019-05-10T23:41:27Z,1203,17,2
Google I/O'19 - Android: 5G,2019-05-10T23:39:15Z,1852,26,1
Google I/O'19 - Voices of I/O,2019-05-10T23:37:51Z,1218,18,0
Google I/O'19 - Ml/IA Bioacoustic Whale Detection & Flood Prediction Sandbox Demo,2019-05-10T23:36:34Z,688,7,0
Google I/O'19 - Sandbox Tour,2019-05-10T23:34:23Z,1127,9,0
Google I/O'19 - Manuel Bronstein Interview on Assistant,2019-05-10T23:31:09Z,1007,19,1
Google I/O'19 - Harsh Kharbanda Interview on Lens in Google Go,2019-05-10T23:29:43Z,585,17,0
Google I/O'19 - Google Assistant Sandbox Demo,2019-05-10T23:27:21Z,932,14,1
Google I/O'19 - Prabhu Balasubramanian Interview on Nest Hub Max,2019-05-10T23:20:23Z,1416,11,0
Google I/O'19 - Soniya Jobanputra Interview on Pixel 3a and Pixel 3a XL,2019-05-10T23:16:47Z,22484,82,34
Google I/O'19 - Chet Haase Interview on Jetpack Compose,2019-05-10T23:12:55Z,2928,49,5
Google I/O'19 - Elise Roy Interview,2019-05-10T23:09:36Z,744,18,2
Google I/O'19 - Daniel Galpin Interview on Android,2019-05-10T23:05:09Z,653,12,3
Google I/O'19 - Boardwalk Tour,2019-05-10T22:59:05Z,852,11,0
"Engaging Customers Beyond Payments: Tickets, Transit, and Boarding Passes (Google I/O'19)",2019-05-10T17:57:10Z,10134,83,9
"A Fireside Chat with X’s Captain of Moonshots, Astro Teller (Google I/O'19)",2019-05-10T01:01:33Z,8327,110,4
"Physicist, Michio Kaku take on the future of humanity at Google I/O (2019)",2019-05-10T00:47:07Z,298220,6485,324
An Unconventional Look at the Future of Technology with Baratunde Thurston (Google I/O'19),2019-05-10T00:29:33Z,5240,114,6
"Fireside Chat with Hiroshi Lockheimer, Google Sr. VP, Platforms and Ecosystems (Google I/O'19)",2019-05-10T00:11:59Z,13658,152,12
Seamless and Smooth Location Everywhere with the new FusedLocationProvider (Google I/O'19),2019-05-09T21:36:48Z,8268,135,11
[DEPRECATING] Voice and Visual: How to Build Actions for Smart Displays and More (Google I/O'19),2019-05-09T21:21:49Z,2528,43,2
Google AI Impact Challenge: Using Technology to Change the World (Google I/O'19),2019-05-09T21:10:57Z,2373,33,0
AR as a Feature: How to Supercharge Products Using Augmented Reality (Google I/O'19),2019-05-09T20:58:53Z,14152,163,8
IoT with Sigfox and Google Cloud (Google I/O'19),2019-05-09T19:56:51Z,3910,68,5
AI vs Climate Change: Insights from the Cutting Edge (Google I/O'19),2019-05-09T19:54:57Z,9467,227,8
Tools for Building Better Smart Home Actions (Google I/O'19),2019-05-09T19:53:18Z,3301,42,0
Art and Technology Experiments with Google Arts and Culture (Google I/O'19),2019-05-09T17:35:18Z,6458,101,3
Modern Web Game Development (Google I/O'19),2019-05-09T17:35:10Z,41694,803,12
"Film Screening: nimiia cétiï, an Art and Machine Learning Project By Jenna Sutela (Google I/O'19)",2019-05-09T17:30:18Z,1438,22,1
"Flutter support for Android, iOS, and more news (2019)",2019-05-09T14:59:54Z,150545,4544,165
Artificial Intelligence: From Social Good to Ambient Intelligence (Google I/O'19),2019-05-09T05:52:55Z,4356,45,2
Smart Home 101: How to Develop for the Connected Home (Google I/O'19),2019-05-09T05:46:12Z,11754,100,2
Augmenting Faces and Images (Google I/O'19),2019-05-09T01:50:42Z,15007,234,26
Music and Machine Learning (Google I/O'19),2019-05-09T01:00:18Z,46846,764,24
Increasing AR Realism with Lighting (Google I/O'19),2019-05-08T23:36:11Z,9295,142,5
What’s New in the Google Cast SDK (Google I/O'19),2019-05-08T22:39:55Z,7838,81,4
Developing the First AR Experience for Google Maps (Google I/O'19),2019-05-08T22:36:58Z,30865,371,11
What’s New in ARCore (Google I/O'19),2019-05-08T21:14:12Z,68743,872,55
Smart Strategies for Growing Your App Business with Ads (Google I/O'19),2019-05-08T20:06:50Z,2991,36,2
Stadia Streaming Tech: A Deep Dive (Google I/O'19),2019-05-08T19:51:25Z,39640,651,34
Making Art with Artificial Intelligence: Artists in Conversation (Google I/O'19),2019-05-08T19:28:51Z,27919,591,14
Designing AR Applications (Google I/O'19),2019-05-08T19:10:18Z,17734,304,14
"On Creativity and Technology, with Legendary Animator Glen Keane (Google I/O'19)",2019-05-08T19:00:13Z,27652,1007,25
Google Maps Platform: A Deep Dive on Building for Performance and Scale (Google I/O'19),2019-05-08T02:04:01Z,10826,134,5
Building Powerful Checkout Experiences with Google Pay (Google I/O'19),2019-05-08T01:59:27Z,9845,106,6
Developer Keynote (Google I/O '19),2019-05-08T01:17:13Z,169077,2114,68
What's New in Gaming at Google (Google I/O'19),2019-05-08T01:16:16Z,23668,346,14
Teaching a Car to Drive Itself by Imitation and Imagination (Google I/O'19),2019-05-08T00:50:43Z,9405,151,7
Developer spotlight: Concepts & BandLab,2019-05-07T23:11:18Z,3136,50,2
Google Keynote (Google I/O'19),2019-05-07T21:57:34Z,1920210,30294,169
mixi's XFLAG and the Google Maps Platform gaming solution,2019-05-06T22:16:41Z,5111,27,1
"Android Q Scoped Storage, Image Segmentation with Cloud TPUs, & New In Chrome 74",2019-05-02T22:48:49Z,12729,427,11
International Women's Day ‘19 featuring Actions on Google,2019-05-01T16:24:10Z,4173,114,6
Smart Home Integrations on Google Assistant (Assistant on Air),2019-04-26T23:16:08Z,14009,217,10
"Indie Games Accelerator, Android Studio 3.4, & Scheduling Cloud Functions for Firebase",2019-04-25T23:20:30Z,10847,390,8
#HowICode Implementing Other Works,2019-04-23T23:28:47Z,15233,551,15
"👋Hello, World! 👋 | A New Home for Developers on Instagram",2019-04-23T20:39:58Z,2461,40,10
All Google Cloud Next ‘19 updates & more!,2019-04-18T23:34:49Z,7702,235,4
What Developer Student Club experienced af the Cloud Study Jam in Ghana,2019-04-16T22:07:41Z,23984,496,27
"Android Q beta 2, Cloud Healthcare API beta, & ML Kit for Natural Language Processing",2019-04-11T21:28:41Z,12959,321,14
#HowICode Commit Messages Best Practice,2019-04-09T18:33:58Z,18020,389,15
"Google Summer of Code 2019, Firebase Realtime Database, & Cloud Security",2019-04-04T23:44:39Z,15467,542,14
"Android Q Beta, Firebase Crashlytics for Unity, Google Maps Platform for gaming, & more!",2019-03-28T22:43:14Z,12653,442,10
Building on Android (GDC 2019),2019-03-27T00:05:17Z,4399,57,1
"Create, connect, and scale with Google (GDC 2019)",2019-03-27T00:04:32Z,1561,22,1
Building successful monetization and growth strategies (GDC 2019),2019-03-27T00:03:35Z,4627,57,2
Keynote + Tools and best practices to improve game quality (GDC 2019),2019-03-27T00:02:58Z,9803,203,15
#HowICode Creating Aliases,2019-03-26T21:20:41Z,11452,351,25
Google GDC 2019 Gaming Announcement,2019-03-19T18:08:57Z,225734,4832,4
Mobile Developer Day at GDC 2019 Livestream,2019-03-18T23:13:14Z,80752,1482,25
Introducing Google Coral for developing AI & GPipe for deep neural network training,2019-03-14T22:07:48Z,17855,550,15
#HowICode CSS Committing with git add -p,2019-03-12T19:03:18Z,15445,245,24
Top 5 takeaways from TensorFlow Dev Summit 2019,2019-03-08T18:20:31Z,16277,448,16
".dev as a home for developers, Flutter 1.2 at MWC ‘19, & Go 1.12",2019-03-08T02:25:27Z,12720,375,16
Find out what’s new in TensorFlow 2.0 at #TFDevSummit '19,2019-03-06T01:33:59Z,16166,428,18
"AI-Powered speech, Flutter Create, & new Apigee analytics for API data",2019-02-28T22:16:34Z,22909,577,19
Google 4 Indonesia Developer Showcase,2019-02-27T23:17:14Z,9355,319,18
Announcing Flutter’s very own YouTube 📺channel!,2019-02-22T23:35:44Z,21562,883,55
Introducing Flutter Create,2019-02-22T16:47:19Z,21968,550,53
"AR selfies & animation in ARCore v1.7, Introducing PlaNet for reinforcement learning, & more!",2019-02-21T23:47:49Z,12059,361,17
Google Developers brings its Machine Learning Bootcamp to Indonesia,2019-02-21T00:29:23Z,28305,549,43
"Reinforcement learning with Dopamine 2.0, ClusterFuzz, Google Sign In & more!",2019-02-15T00:45:49Z,16408,467,13
Positioned (Flutter Widget of the Week),2019-02-12T18:47:56Z,323579,3268,53
"New in Chrome 72, Google Maps Places SDKs, Cloud Firestore GA, & more!",2019-02-08T00:00:46Z,12880,342,21
"Using Flutter Inspector and Preserving Scroll Position (The Boring Flutter Development Show, Ep. 15)",2019-02-06T21:39:19Z,18776,281,41
Align (Flutter Widget of the Week),2019-02-05T17:00:01Z,268436,2676,53
"Open sourcing Cloud Search SDK, Chrome 73 DevTools updates, Spring Cloud GCP 1.1, & more!",2019-01-31T22:31:21Z,9309,330,7
BackdropFilter (Flutter Widget of the Week),2019-01-29T21:57:23Z,233717,2885,60
A deaf student becomes an Android app developer for her community,2019-01-29T00:21:27Z,36477,1134,46
"Android Studio 3.3, introducing Feast: a feature store for ML, NVIDIA Tesla T4 GPUs, & more!",2019-01-25T00:01:44Z,27170,755,26
"Incorporating Web View into Your App (The Boring Flutter Development Show, Ep. 14)",2019-01-23T18:01:04Z,31330,542,106
Transform (Flutter Widget of the Week),2019-01-22T18:43:48Z,263471,4044,76
Google and NXP advance artificial intelligence with the Edge TPU,2019-01-19T00:36:58Z,151474,3530,150
Prototype and Validate,2019-01-18T18:56:17Z,8862,187,9
"Easier Kubernetes development, and new BigQuery UI features",2019-01-18T00:19:41Z,8117,268,4
AbsorbPointer (Flutter Widget of the Week),2019-01-15T18:07:28Z,167161,1927,26
"Chrome 72 Beta, Cloud DNS forwarding, Cloud SQL, & more!",2019-01-11T00:07:58Z,23331,649,23
"Influencing the Flutter SDK (The Boring Flutter Development Show, Ep. 13)",2019-01-09T22:10:57Z,13301,268,36
Introducing Women Techmakers… in 60 Seconds!,2019-01-09T14:00:03Z,12670,312,11
LayoutBuilder (Flutter Widget of the Week),2019-01-08T18:04:52Z,246575,2404,42
FittedBox (Flutter Widget of the Week),2019-01-01T17:30:10Z,246670,2536,41
Top 5 Liked Flutter Features,2018-12-29T17:29:52Z,15217,471,43
The ABCs of Inclusive Product Design,2018-12-28T21:23:39Z,10561,214,34
Tooltip (Flutter Widget of the Week),2018-12-27T21:21:06Z,192379,2088,28
CustomPaint (Flutter Widget of the Week),2018-12-18T19:16:44Z,209274,2259,35
"Slivers Explained - Making Dynamic Layouts (The Boring Flutter Development Show, Ep. 12)",2018-12-16T17:29:53Z,108177,1324,101
"Flutter Performance, Flutter Games, Flutter Tooling, & More (#AskFlutter at Flutter Live)",2018-12-14T17:12:10Z,20358,280,19
"Flutter 1.0 release, ARCore & Sceneform updates, Android Codelabs , Drive APIs, & more!",2018-12-13T23:26:29Z,21295,445,19
"Origin of Flutter, Dart 2.0, E-Commerce with Flutter, & More (#AskFlutter at Flutter Live)",2018-12-13T17:23:03Z,9374,174,5
"Google Maps for Flutter, Platform Channels, Mobile Ads, & More - #AskFlutter at Flutter Live",2018-12-13T01:19:57Z,15125,307,31
Hero (Flutter Widget of the Week),2018-12-11T18:05:43Z,478675,5629,61
Flutter Live Event Guides Highlights,2018-12-10T21:17:17Z,3020,50,2
Interview With Will Larche (Flutter Live),2018-12-07T23:31:01Z,6333,126,3
Interview With Shams Zakhour (Flutter Live),2018-12-07T23:29:28Z,2405,34,2
Interview With Maurice Parrish (Flutter Live),2018-12-07T23:28:20Z,2234,44,2
Interview With Tao Dong and Ja Young Lee (Flutter Live),2018-12-07T23:24:45Z,2715,39,3
Interview With Nilay Yener (Flutter Live),2018-12-07T23:24:14Z,4756,88,2
Interview With Eric Seidel (Flutter Live),2018-12-07T23:23:07Z,7234,105,6
#MyFlutterStory - Stories From Developers Using Flutter,2018-12-07T05:06:42Z,12036,221,7
"Fast Pair update, Android SDK Developers, Chrome 72 DevTools, & more!",2018-12-06T22:31:16Z,8823,275,5
That's a wrap! Flutter Live Sizzle Reel,2018-12-06T18:59:10Z,5724,127,6
Flutter App Highlight Reel,2018-12-05T19:25:30Z,113755,920,38
Abbey Road Studios (Flutter Developer Story),2018-12-05T12:58:59Z,62469,751,26
Flutter Live - Flutter Announcements and Updates (Livestream),2018-12-05T02:19:45Z,125360,1656,40
Flutter Live Keynote Recap,2018-12-05T01:25:58Z,75823,1004,46
"One More Thing (Flutter Live, Keynote Part 4)",2018-12-04T20:45:49Z,41287,974,45
"Flutter Development (Flutter Live, Keynote Part 3)",2018-12-04T20:41:45Z,58780,806,57
"Flutter Design (Flutter Live, Keynote Part 2)",2018-12-04T20:29:52Z,62858,1043,37
"Announcing Flutter 1.0 (Flutter Live, Keynote Part 1)",2018-12-04T20:26:30Z,160443,3261,217
"Flutter 1.0, Square Reader SDK, 2Dimensions Flare, & More! (Flutter Live Top 5 Recap)",2018-12-04T19:50:47Z,21404,669,18
"Wear OS API 28 emulator, Cloud Identity secure LDAP, what’s new in Firebase, & more!",2018-11-30T00:50:04Z,6499,186,7
#AskFlutter at Flutter Live - Ask us your questions!,2018-11-29T17:41:31Z,4653,145,53
ClipRRect (Flutter Widget of the Week),2018-11-27T18:00:45Z,228143,2435,37
When to Use Keys - Flutter Widgets 101 Ep. 4,2018-11-26T18:21:42Z,520627,8754,252
Announcing Flutter Live!,2018-11-23T11:00:03Z,25714,361,31
"NVIDIA Tesla T4 GPU, Chrome Dev Summit, Dart 2.1, & DevFest On Air",2018-11-22T19:58:57Z,11216,250,9
"Exploring Flutter Samples and Examples (The Boring Flutter Development Show, Ep. 11)",2018-11-22T01:25:49Z,30911,596,62
InheritedModel (Flutter Widget of the Week),2018-11-20T17:59:51Z,128494,1679,35
A guide to Inherited Widgets - Flutter Widgets 101 Ep. 3,2018-11-19T18:14:59Z,237390,3636,128
"#AndroidDevSummit '18, AI Hub & Kubeflow Pipelines for businesses, Cloud Scheduler, & more!",2018-11-15T23:18:08Z,10950,378,8
"Speed tooling, Squoosh.app & more! (Chrome Dev Summit Top 5 Recap)",2018-11-14T03:51:30Z,10752,323,13
StreamBuilder (Flutter Widget of the Week),2018-11-13T18:06:11Z,327092,3911,56
How Stateful Widgets Are Used Best - Flutter Widgets 101 Ep. 2,2018-11-12T18:25:43Z,331736,4038,70
"Foldables, App Bundles & more from Android Dev Summit ‘18!",2018-11-09T01:57:21Z,20294,588,9
"G Suite Developer Hub, Introducing AdaNet: Fast & Flexible AutoML, & more!",2018-11-08T18:05:03Z,10002,294,13
The Developer Show at Cloud Next ‘18 in London,2018-11-07T22:18:19Z,3463,100,7
FadeInImage (Flutter Widget of the Week),2018-11-06T18:02:02Z,164213,1884,43
How to Create Stateless Widgets - Flutter Widgets 101 Ep. 1,2018-11-05T19:45:27Z,283468,4033,95
Introducing Flutter Widgets 101,2018-11-02T16:55:22Z,82500,990,34
"Android Developer Training, Chrome 71 Beta, Firebase Summit 2018, & more!",2018-11-01T21:05:46Z,8949,304,5
"Flutter's Search Support (The Boring Flutter Development Show, Ep. 10)",2018-10-31T19:15:09Z,63763,915,114
SliverList & SliverGrid (Flutter Widget of the Week),2018-10-30T17:00:46Z,397758,2838,41
Top 5 from the Firebase Summit 2018,2018-10-29T18:13:13Z,12638,332,7
"Playtime 2018, Gmail Compose Actions, Google Cloud partners with NASA, & more!",2018-10-25T22:32:42Z,7583,231,12
